{
  "agent": "entertainment",
  "status": "complete",
  "data": {
    "days": [
      {
        "day": 1,
        "date": "2026-05-02",
        "location": "Beijing",
        "entertainment": [
          {
            "name_base": "Qianmen Street Night Stroll (前门大街)",
            "name_local": "前门大街",
            "location_base": "Qianmen Street, Dongcheng District, Beijing",
            "location_local": "北京市东城区前门大街",
            "coordinates": {
              "lat": 39.8991,
              "lng": 116.3913
            },
            "cost": 0,
            "currency_local": "CNY",
            "time": {
              "start": "19:00",
              "end": "22:00"
            },
            "type_base": "Night walk / Cultural street",
            "type_local": "夜间步行 / 文化街区",
            "note_base": "Free to walk; shops and snack stalls open until ~22:00",
            "note_local": "免费散步，商店和小吃摊开放至约22:00",
            "notes_base": "A historic commercial pedestrian street stretching south from Tiananmen. Lanterns and traditional architecture are beautifully lit at night. Ideal for a first evening orientation in Beijing. Many budget snack options available.",
            "notes_local": "从天安门向南延伸的历史商业步行街。夜晚灯笼和传统建筑灯光优美。适合初到北京的夜间游览，有很多平价小吃。",
            "optional": false,
            "search_results": [
              {
                "skill": "gaode-maps",
                "type": "poi_search",
                "url": "https://uri.amap.com/marker?position=116.3913,39.8991&name=%E5%89%8D%E9%97%A8%E5%A4%A7%E8%A1%97",
                "display_text": "Gaode Maps - 前门大街"
              }
            ],
            "image_url": "https://store.is.autonavi.com/showpic/34231e4fb695d9aebac2a72575212a97"
          },
          {
            "name_base": "Nanluoguxiang Hutong Evening Walk (南锣鼓巷)",
            "name_local": "南锣鼓巷",
            "location_base": "Nanluoguxiang, Dongcheng District, Beijing",
            "location_local": "北京市东城区南锣鼓巷",
            "coordinates": {
              "lat": 39.9354,
              "lng": 116.4034
            },
            "cost": 0,
            "currency_local": "CNY",
            "time": {
              "start": "20:00",
              "end": "22:00"
            },
            "type_base": "Hutong evening walk / Cultural neighborhood",
            "type_local": "胡同夜游 / 文化街区",
            "note_base": "Free to walk; bars and artisan shops line the alley",
            "note_local": "免费游览，巷内有酒吧和手工艺品店",
            "notes_base": "One of Beijing's best-preserved hutong alleys. Lined with independent cafes, bars, craft shops, and street food. The atmosphere is lively but walkable at night. Perfect after Qianmen to experience local Beijing neighborhood culture.",
            "notes_local": "北京保存最完好的胡同之一，两侧有独立咖啡馆、酒吧、手工艺品店和街头小吃。夜晚气氛热闹，适合步行。前门之后体验北京胡同文化的好去处。",
            "optional": true,
            "search_results": [
              {
                "skill": "gaode-maps",
                "type": "poi_search",
                "url": "https://uri.amap.com/marker?position=116.4034,39.9354&name=%E5%8D%97%E9%94%A3%E9%BC%93%E5%B7%B7",
                "display_text": "Gaode Maps - 南锣鼓巷"
              }
            ],
            "image_url": "https://store.is.autonavi.com/showpic/6aa94c24640267a56c22af0b9629030a"
          }
        ]
      },
      {
        "day": 2,
        "date": "2026-05-03",
        "location": "Beijing",
        "entertainment": [
          {
            "name_base": "Houhai Bar Street Evening (后海酒吧街)",
            "name_local": "后海酒吧街",
            "location_base": "Houhai Lake area, Xicheng District, Beijing",
            "location_local": "北京市西城区后海湖区",
            "coordinates": {
              "lat": 39.9399,
              "lng": 116.3844
            },
            "cost": 30,
            "currency_local": "CNY",
            "time": {
              "start": "20:30",
              "end": "23:00"
            },
            "type_base": "Lakeside bar street / Night view",
            "type_local": "湖畔酒吧街 / 夜景",
            "note_base": "Drinks from ~30-60 CNY; free to walk along the lake",
            "note_local": "酒水约30-60元，沿湖散步免费",
            "notes_base": "After a tiring Great Wall day, the lakeside Houhai area offers a relaxed evening option. You can stroll around the lake for free or stop for a cold drink at one of the many bars. Live music often heard from open-air venues. Low energy required — good rest-day entertainment.",
            "notes_local": "长城一日游后，后海湖畔提供轻松的夜晚选择。可免费绕湖散步，或在众多酒吧之一停下来喝杯冷饮。露天场所常有现场音乐。体力消耗少，适合休息日娱乐。",
            "optional": true,
            "search_results": [
              {
                "skill": "gaode-maps",
                "type": "poi_search",
                "url": "https://uri.amap.com/marker?position=116.3844,39.9399&name=%E5%90%8E%E6%B5%B7%E9%85%92%E5%90%A7%E8%A1%97",
                "display_text": "Gaode Maps - 后海酒吧街"
              }
            ],
            "image_url": "https://store.is.autonavi.com/showpic/3db6fbc9b47c73f56a9482c1f1f27505"
          }
        ]
      },
      {
        "day": 3,
        "date": "2026-05-04",
        "location": "Datong",
        "entertainment": [
          {
            "name_base": "Datong Ancient City Wall Night View (大同古城墙夜景)",
            "name_local": "大同古城墙",
            "location_base": "Ancient City Wall, Datong City Center, Shanxi",
            "location_local": "山西省大同市古城墙",
            "coordinates": {
              "lat": 40.0897,
              "lng": 113.2934
            },
            "cost": 0,
            "currency_local": "CNY",
            "time": {
              "start": "20:00",
              "end": "21:30"
            },
            "type_base": "Historic landmark / Night walk",
            "type_local": "历史地标 / 夜间游览",
            "note_base": "Exterior walkable for free; city wall illuminated at night",
            "note_local": "外围免费步行，城墙夜间亮灯",
            "notes_base": "Datong's restored ancient city walls are lit up at night and worth a short evening stroll after arriving from Beijing. The main gate areas are especially photogenic. Keep it brief as Yungang Grottoes will be the main energy expenditure the next day.",
            "notes_local": "大同修复的古城墙夜间亮灯，从北京抵达后可做短暂夜游。主城门区域特别适合拍照。由于明天云冈石窟是主要游览项目，今晚活动量不宜过大。",
            "optional": true,
            "search_results": [
              {
                "skill": "gaode-maps",
                "type": "poi_search",
                "url": "https://uri.amap.com/marker?position=113.2934,40.0897&name=%E5%A4%A7%E5%90%8C%E5%8F%A4%E5%9F%8E%E5%A2%99",
                "display_text": "Gaode Maps - 大同古城墙"
              }
            ],
            "image_url": "https://aos-comment.amap.com/B0FFGRMZMG/comment/176931065054_1769310654298_58754273.jpg"
          }
        ]
      },
      {
        "day": 4,
        "date": "2026-05-05",
        "location": "Datong",
        "entertainment": []
      },
      {
        "day": 5,
        "date": "2026-05-06",
        "location": "Chengdu",
        "entertainment": [
          {
            "name_base": "Jinli Ancient Street Evening (锦里古街)",
            "name_local": "锦里古街",
            "location_base": "Jinli Street, Wuhou District, Chengdu, Sichuan",
            "location_local": "四川省成都市武侯区锦里古街",
            "coordinates": {
              "lat": 30.6418,
              "lng": 104.0466
            },
            "cost": 0,
            "currency_local": "CNY",
            "time": {
              "start": "19:00",
              "end": "22:00"
            },
            "type_base": "Cultural street / Night market",
            "type_local": "文化街 / 夜市",
            "note_base": "Free to enter; snacks and souvenirs cost extra (~20-50 CNY)",
            "note_local": "免费入场，小吃和纪念品另付（约20-50元）",
            "notes_base": "Matilde solo evening activity. Jinli is a beautifully restored Han Dynasty-era street adjacent to Wuhou Shrine, lined with red lanterns, Sichuan street food stalls (rabbit heads, spicy skewers, glutinous rice), tea houses, and folk craft shops. Extremely lively at night. Safe for solo traveler.",
            "notes_local": "Matilde独自夜间活动。锦里是紧邻武侯祠的汉代风格修复街道，挂满红灯笼，有四川街头小吃（兔头、麻辣串串、糯米糍）、茶馆和民间工艺品店。夜间非常热闹，独行旅客安全。",
            "optional": false,
            "search_results": [
              {
                "skill": "gaode-maps",
                "type": "poi_search",
                "url": "https://uri.amap.com/marker?position=104.0466,30.6418&name=%E9%94%A6%E9%87%8C%E5%8F%A4%E8%A1%97",
                "display_text": "Gaode Maps - 锦里古街"
              }
            ],
            "image_url": "https://aos-comment.amap.com/B0L0JMFXP3/comment/content_media_external_file_2913_1772972006160_60195924.jpg"
          }
        ]
      },
      {
        "day": 6,
        "date": "2026-05-07",
        "location": "Chengdu",
        "entertainment": [
          {
            "name_base": "Kuanzhai Alley Night Walk (宽窄巷子夜游)",
            "name_local": "宽窄巷子",
            "location_base": "Kuanzhai Alley, Qingyang District, Chengdu, Sichuan",
            "location_local": "四川省成都市青羊区宽窄巷子",
            "coordinates": {
              "lat": 30.6681,
              "lng": 104.0536
            },
            "cost": 0,
            "currency_local": "CNY",
            "time": {
              "start": "20:00",
              "end": "22:00"
            },
            "type_base": "Historic alley / Night entertainment district",
            "type_local": "历史巷子 / 夜间娱乐区",
            "note_base": "Free entry; drinks and snacks available along the alleys",
            "note_local": "免费进入，巷子内有饮品和小吃",
            "notes_base": "After returning from the Leshan day trip, a relaxed evening stroll through Chengdu's famous Wide and Narrow Alleys (Kuan Alley + Zhai Alley + Jing Alley). Qing Dynasty architecture, courtyard bars, tea houses, and Sichuan opera face-changing (变脸) performances at some restaurants. Good for reuniting the two travelers at a relaxed pace.",